{"success":false,"confidence":"high","tool_executed":"mcp__mittwald__mittwald_database_mysql_create","timestamp":"2025-12-19T10:34:00Z","problems_encountered":[{"type":"api_error","description":"HTTP 500 Internal Server Error when creating MySQL database. API endpoint failure."}],"resources_created":[],"resources_verified":[],"tool_response_summary":"Failed with 500 server error. API endpoint issue.","execution_notes":"Tool called correctly but API returned server error."}
