{"success":false,"confidence":"high","tool_executed":"mcp__mittwald__mittwald_cronjob-create","timestamp":"2025-12-19T10:36:00Z","problems_encountered":[{"type":"dependency_missing","description":"Required resource does not exist or cannot be created."}],"resources_created":[],"resources_verified":[],"tool_response_summary":"Tool not executed - missing prerequisites.","execution_notes":"Dependency not available for testing."}
