{
  "success": false,
  "confidence": "high",
  "tool_executed": "mcp__mittwald__mittwald_mail_deliverybox_create",
  "timestamp": "2025-12-19T09:52:57Z",
  "problems_encountered": [
    {
      "type": "validation_error",
      "description": "password parameter required - randomPassword not supported in library mode"
    }
  ],
  "resources_created": [],
  "resources_verified": [],
  "tool_response_summary": "Failed - password parameter required",
  "execution_notes": "Library mode limitation: randomPassword option not available, must provide explicit password."
}
