{
  "success": false,
  "confidence": "high",
  "tool_executed": "mcp__mittwald__mittwald_database_mysql_delete",
  "timestamp": "2025-12-19T14:47:50.000Z",
  "problems_encountered": [
    {
      "type": "dependency_missing",
      "description": "Cannot execute: requires existing MySQL database ID. No databases available."
    }
  ],
  "resources_created": [],
  "resources_verified": [],
  "tool_response_summary": "Not executed - prerequisite dependency missing.",
  "execution_notes": "Tool requires databaseId parameter to delete database."
}
