{"success":false,"confidence":"high","tool_executed":"mcp__mittwald__mittwald_mail_deliverybox_create","timestamp":"2025-12-19T11:39:01Z","problems_encountered":[{"type":"validation_error","description":"password is required (randomPassword not supported in library mode)"}],"resources_created":[],"resources_verified":[],"tool_response_summary":"Failed to create delivery box - password parameter required","execution_notes":"Tool requires explicit password parameter. Random password generation not available in library mode."}
