{
  "success": false,
  "confidence": "high",
  "tool_executed": "mcp__mittwald__mittwald_project_delete",
  "timestamp": "2025-12-19T11:37:35Z",
  "problems_encountered": [
    {
      "type": "permission_denied",
      "description": "HTTP 403 Forbidden - Cannot delete newly created project (may require special permissions or waiting period)"
    }
  ],
  "resources_created": [],
  "resources_verified": [],
  "tool_response_summary": "Failed to delete project d3201a21-05ec-4154-af61-19ea7784ca95 - 403 permission denied",
  "execution_notes": "Project was just created in previous step. Deletion failed with 403, possibly due to permissions or API restrictions on immediate deletion. Execution time: 113ms"
}
