{
  "success": false,
  "confidence": "high",
  "tool_executed": "mcp__mittwald__mittwald_cronjob_execution_abort",
  "timestamp": "2025-12-19T00:24:45Z",
  "problems_encountered": [
    {
      "type": "dependency_missing",
      "description": "Cannot test cronjob/execution/abort because no cronjobs exist to have running executions. Depends on cronjob/create which is broken."
    }
  ],
  "resources_created": [],
  "resources_verified": [],
  "tool_response_summary": "Unable to execute - no cronjob executions available to abort",
  "execution_notes": "This tool requires a running cronjob execution. Since no cronjobs exist in the test project (cronjob/create is broken), this eval cannot be completed."
}
