{
  "success": false,
  "confidence": "high",
  "tool_executed": "mcp__mittwald__mittwald_mail_address_delete",
  "timestamp": "2025-12-19T00:43:00Z",
  "problems_encountered": [
    {
      "type": "dependency_missing",
      "description": "Cannot test this tool because no mail addresses exist. Tool requires a valid mail address ID to delete."
    }
  ],
  "resources_created": [],
  "resources_verified": [],
  "tool_response_summary": "Tool not executed due to missing prerequisites. No mail addresses available for testing.",
  "execution_notes": "Tool requires a valid mail address ID to perform deletion. Since no mail addresses exist, this eval cannot be completed."
}
