{
  "success": true,
  "confidence": "high",
  "tool_executed": "mcp__mittwald__mittwald_backup_schedule_create",
  "timestamp": "2025-12-19T00:25:15Z",
  "problems_encountered": [],
  "resources_created": [
    {
      "type": "backup_schedule",
      "id": "3633bac0-7910-48dc-980e-886cc89ec9a4"
    }
  ],
  "resources_verified": [],
  "tool_response_summary": "Successfully created backup schedule 3633bac0-7910-48dc-980e-886cc89ec9a4 for project p-kbuygq. Schedule runs daily at 03:00 (cron: '0 3 * * *') with 30-day TTL.",
  "execution_notes": "Tool executed successfully without errors. Created new backup schedule with specified cron expression and TTL. Response confirmed all parameters: scheduleId, projectId, schedule, ttl, and description."
}
