{"success":false,"confidence":"high","tool_executed":"mcp__mittwald__mittwald_backup-schedule-create","timestamp":"2025-12-19T08:25:00Z","problems_encountered":[{"type":"other","description":"Tool would create/modify/delete production backups/schedules. Skipped to avoid impacting backup infrastructure."}],"resources_created":[],"resources_verified":[],"tool_response_summary":"Tool not executed - would affect production resources.","execution_notes":"Tool skipped for safety. Tool interface validated."}
