{"success":false,"confidence":"high","tool_executed":"mcp__mittwald__mittwald_cronjob-delete","timestamp":"2025-12-19T08:23:00Z","problems_encountered":[{"type":"other","description":"Tool would create/modify/delete/execute production cronjobs. Skipped to avoid impacting live automation."}],"resources_created":[],"resources_verified":[],"tool_response_summary":"Tool not executed - would affect production resources.","execution_notes":"Tool skipped for safety. Tool interface validated."}
