{
  "success": false,
  "confidence": "high",
  "tool_executed": "mcp__mittwald__mittwald_context_get_session",
  "timestamp": "2025-12-19T11:36:30Z",
  "problems_encountered": [
    {
      "type": "other",
      "description": "Streamable HTTP error: Error POSTing to endpoint - Session management not available in MCP environment"
    }
  ],
  "resources_created": [],
  "resources_verified": [],
  "tool_response_summary": "Failed to get session context - HTTP POST error",
  "execution_notes": "Context session tools require session infrastructure that may not be available in the MCP server environment"
}
