{
  "success": false,
  "confidence": "high",
  "tool_executed": "mcp__mittwald__mittwald_domain_dnszone_update",
  "timestamp": "2025-12-19T00:34:00Z",
  "problems_encountered": [
    {
      "type": "dependency_missing",
      "description": "Cannot test this tool because no DNS zones exist in the available projects. Tool requires a valid dnszoneId parameter to update."
    }
  ],
  "resources_created": [],
  "resources_verified": [],
  "tool_response_summary": "Tool not executed due to missing prerequisites. No DNS zones available for testing.",
  "execution_notes": "Tool requires a valid DNS zone ID and record set data to function. Since no domains/DNS zones exist in test projects, this eval cannot be completed."
}
