{
  "success": false,
  "confidence": "high",
  "tool_executed": "mcp__mittwald__mittwald_context_set_session",
  "timestamp": "2025-12-19T10:26:00Z",
  "problems_encountered": [
    {
      "type": "permission_denied",
      "description": "Access denied to project fd1ef726-14b8-4906-8a45-0756ba993246. API returned 403 error."
    }
  ],
  "resources_created": [],
  "resources_verified": [],
  "tool_response_summary": "Failed with access denied error when attempting to set project context.",
  "execution_notes": "Tool called correctly but API returned permission denied. This tests that the tool properly handles and reports auth errors."
}
