{
  "success": true,
  "confidence": "high",
  "tool_executed": "mcp__mittwald__mittwald_cronjob_execute",
  "timestamp": "2025-12-19T14:52:00Z",
  "problems_encountered": [],
  "resources_created": [
    {
      "type": "cronjob_execution",
      "id": "cron-t27y24-1766151792"
    }
  ],
  "resources_verified": [],
  "tool_response_summary": "Successfully started manual execution of cronjob 840e82c8-cea9-4e41-be33-17f6b599a061. Execution ID: cron-t27y24-1766151792.",
  "execution_notes": "Tool executed successfully in 96ms. Execution triggered outside of normal schedule."
}
