{
  "success": false,
  "confidence": "high",
  "tool_executed": "mcp__mittwald__mittwald_registry_delete",
  "timestamp": "2025-12-19T15:01:00.000Z",
  "problems_encountered": [
    {
      "type": "resource_not_found",
      "description": "Registry not found when attempting deletion (HTTP 404). Registry ID: 683b380e-24b9-4d16-b631-b94082cf71e1. May have been auto-deleted or not properly persisted after creation."
    }
  ],
  "resources_created": [],
  "resources_verified": [],
  "tool_response_summary": "Failed to delete registry - resource not found (HTTP 404).",
  "execution_notes": "Tool executed but API returned 404. Registry was created in eval 22 and updated in eval 23, but cannot be found for deletion. Response time: 98.0ms before failure."
}
