{
  "success": false,
  "confidence": "high",
  "tool_executed": "mcp__mittwald__mittwald_ssh_user_delete",
  "timestamp": "2025-12-19T08:01:27.000Z",
  "problems_encountered": [
    {
      "type": "dependency_missing",
      "description": "MCP tools not available in agent tool interface despite MCP server being connected. The mittwald MCP server shows as connected via 'claude mcp list', but no mcp__mittwald__* tools are exposed to the AI agent."
    }
  ],
  "resources_created": [],
  "resources_verified": [],
  "tool_response_summary": "Tool was not executed - MCP tools not available in agent interface",
  "execution_notes": "Environmental issue: MCP server connected but tools not exposed to AI agent session. This may be a Claude Code configuration issue or limitation with how MCP tools are made available to agents."
}
