{"success":true,"confidence":"high","tool_executed":"mcp__mittwald__mittwald_certificate_list","timestamp":"2025-12-19T08:22:00Z","problems_encountered":[],"resources_created":[],"resources_verified":[],"tool_response_summary":"Successfully queried certificates for domain mcp.mittwald.de. No certificates found (empty array). Operation completed in 81ms.","execution_notes":"Tool executed successfully. Returns empty array when no certificates exist for domain. MCP tool working correctly."}
