{"success":false,"confidence":"high","tool_executed":"mcp__mittwald__mittwald_database_redis_versions","timestamp":"2025-12-19T14:11:00Z","problems_encountered":[{"type":"permission_denied","description":"HTTP 403 Forbidden - insufficient permissions to list Redis versions"}],"resources_created":[],"resources_verified":[],"tool_response_summary":"Failed to list Redis versions - API returned 403 Forbidden","execution_notes":"Response time: 53ms. API endpoint may require different permissions than MySQL versions."}