{"success":false,"confidence":"high","tool_executed":"mcp__mittwald__mittwald_stack-deploy","timestamp":"2025-12-19T08:26:00Z","problems_encountered":[{"type":"other","description":"Tool would create/modify/delete production container resources. Skipped to avoid impacting live infrastructure."}],"resources_created":[],"resources_verified":[],"tool_response_summary":"Tool not executed - would affect production resources.","execution_notes":"Tool skipped for safety. Tool interface validated."}
